{
  "kind": "answer_to_pending_question",
  "tool": "ask_user_question",
  "callId": "provider-call-1",
  "requestId": "11111111-1111-4111-8111-111111111111",
  "questions": [
    {
      "id": "mode",
      "question": "Choose a mode",
      "header": "Mode",
      "options": [
        {
          "label": "Fast",
          "description": "Shorter wait"
        },
        {
          "label": "Careful"
        }
      ]
    }
  ],
  "answers": [
    {
      "id": "mode",
      "selected": [
        "Fast"
      ]
    }
  ]
}
